{
  "pageskim": "0.1",
  "title": "Lighthouse of Alexandria",
  "summary": "The Lighthouse of Alexandria, one of the Seven Wonders of the Ancient World, guided sailors into the harbour of Alexandria for over 1,500 years.",
  "type": "article",
  "url": "https://encyclopedia.example.org/wiki/lighthouse-of-alexandria",
  "lang": "en",
  "updated": "2026-03-12",
  "series": {
    "prev": null,
    "next": null
  },
  "hash": "sha256:51ccefd12a9f083b",
  "toc": [
    {
      "id": "intro",
      "summary": "The Lighthouse of Alexandria, sometimes called the Pharos of Alexandria, was a lighthouse built by the Ptolemaic Kingdom of Ancient Egypt during the reign of…"
    },
    {
      "id": "origin",
      "summary": "Pharos was a small island just off the coast of Alexandria, connected to the city by a man-made causeway called the Heptastadion, which thereby formed one side…"
    },
    {
      "id": "construction",
      "summary": "The lighthouse was built from large blocks of light-coloured stone — a combination of limestone in the body and granite at points of structural stress…"
    },
    {
      "id": "height-and-description",
      "summary": "Descriptions by ancient and medieval travellers agree that the lighthouse rose in three tapering stages: a square lower section with a central core, an…"
    },
    {
      "id": "destruction",
      "summary": "The lighthouse was progressively destroyed by earthquakes in 956, 1303 and 1323 AD."
    },
    {
      "id": "archaeological-research",
      "summary": "In 1994, a team of archaeologists led by Jean-Yves Empereur documented hundreds of large masonry blocks and statuary fragments on the seabed off Fort Qaitbay…"
    },
    {
      "id": "in-ancient-and-medieval-accounts",
      "summary": "The lighthouse appears in a remarkably continuous chain of testimony: Strabo and Pliny the Elder describe it in the first centuries BC and AD, Arab geographers…"
    },
    {
      "id": "legacy",
      "summary": "The lighthouse gave its name to the architectural type: pharos became the word for lighthouse in Greek, and survives in the French phare, Italian and Spanish…"
    },
    {
      "id": "references",
      "summary": "Pliny the Elder, Natural History , Book XXXVI."
    }
  ],
  "facts": {
    "kv": [
      {
        "key": "modified",
        "value": "2026-03-12"
      },
      {
        "key": "location",
        "value": "Pharos, Alexandria, Egypt"
      },
      {
        "key": "coordinates",
        "value": "31°12′50″N 29°53′08″E"
      },
      {
        "key": "construction started",
        "value": "c. 297 BC"
      },
      {
        "key": "completed",
        "value": "c. 283 BC"
      },
      {
        "key": "destroyed",
        "value": "1303–1480 AD (earthquakes)"
      },
      {
        "key": "height",
        "value": "c. 100 m (330 ft)"
      },
      {
        "key": "builder",
        "value": "Sostratus of Cnidus (attributed)"
      },
      {
        "key": "commissioned by",
        "value": "Ptolemy I Soter"
      },
      {
        "key": "cost",
        "value": "800 talents of silver"
      },
      {
        "key": "type",
        "value": "Lighthouse"
      },
      {
        "key": "material",
        "value": "Light-coloured stone, molten lead mortar"
      },
      {
        "key": "successor site",
        "value": "Citadel of Qaitbay (1480)"
      }
    ],
    "tables": []
  },
  "chunks": [
    {
      "id": "intro",
      "summary": "The Lighthouse of Alexandria, sometimes called the Pharos of Alexandria, was a lighthouse built by the Ptolemaic Kingdom of Ancient Egypt during the reign of…",
      "tags": [
        "ptolemaic-kingdom",
        "ancient-egypt",
        "ptolemy-ii-philadelphus",
        "alexandrias-great-harbour"
      ],
      "anchor": "#lighthouse-of-alexandria",
      "text": "\"Pharos\" redirects here. For the island, see Pharos (island). For other uses, see Pharos (disambiguation).\n\nThe Lighthouse of Alexandria, sometimes called the Pharos of Alexandria, was a lighthouse built by the Ptolemaic Kingdom of Ancient Egypt during the reign of Ptolemy II Philadelphus. Construction is generally dated between about 297 and 283 BC. It stood on the eastern tip of the island of Pharos at the entrance to Alexandria's Great Harbour, and estimates of its overall height range around 100 metres. For many centuries it was one of the tallest man-made structures in the world, and it was counted among the Seven Wonders of the Ancient World.\n\nBadly damaged by three earthquakes between 956 and 1323 AD, it became an abandoned ruin. It was the third-longest surviving ancient wonder, after the Mausoleum at Halicarnassus and the still-extant Great Pyramid of Giza. In 1480 the last of its remnant stones were used to build the Citadel of Qaitbay on the same site."
    },
    {
      "id": "origin",
      "summary": "Pharos was a small island just off the coast of Alexandria, connected to the city by a man-made causeway called the Heptastadion, which thereby formed one side…",
      "tags": [
        "ptolemy-i"
      ],
      "anchor": "#origin",
      "text": "Pharos was a small island just off the coast of Alexandria, connected to the city by a man-made causeway called the Heptastadion, which thereby formed one side of the harbour. Because the Egyptian coast is flat and lacked the kind of landmark used at the time for navigation, a marker of some sort at the mouth of the harbour was considered necessary — a function the lighthouse was initially designed to serve. Use of the building as a lighthouse, with a fire and reflective mirrors at the top, is thought to date to around the first century AD.\n\nThe construction is commonly attributed to Sostratus of Cnidus, though ancient sources disagree on whether he was the architect or the financial sponsor of the project. The monument cost 800 talents of silver according to Pliny the Elder — an enormous sum, roughly a tenth of the treasury Ptolemy I held at his accession. Legend holds that Sostratus was forbidden by Ptolemy from putting his name on the work, and that he carved a dedication into the masonry anyway, covering it with plaster bearing the king's name; the plaster was meant to weather away and reveal the builder's inscription to posterity."
    },
    {
      "id": "construction",
      "summary": "The lighthouse was built from large blocks of light-coloured stone — a combination of limestone in the body and granite at points of structural stress…",
      "tags": [
        "ptolemy-i-soter",
        "ptolemy-ii-philadelphus"
      ],
      "anchor": "#construction",
      "text": "The lighthouse was built from large blocks of light-coloured stone — a combination of limestone in the body and granite at points of structural stress, according to the archaeological consensus. The blocks were sealed together with molten lead rather than ordinary mortar, a measure ancient writers explain as protection against the pounding of the waves. Construction on the exposed reef required the platform to be raised above storm level, and the foundation courses were laid directly onto the levelled bedrock of the islet.\n\nWork is thought to have begun under Ptolemy I Soter around 297 BC and to have been completed under his son Ptolemy II Philadelphus around 283 BC, a construction period of roughly twelve to fifteen years. The project drew on the same royal treasury and engineering establishment that produced the Museum and the Library of Alexandria in the same generation, and the three works together made the new capital the most conspicuous city of the Hellenistic world."
    },
    {
      "id": "height-and-description",
      "summary": "Descriptions by ancient and medieval travellers agree that the lighthouse rose in three tapering stages: a square lower section with a central core, an…",
      "tags": [
        "zeus-soter",
        "hermann-thiersch",
        "ibn-battuta"
      ],
      "anchor": "#height-and-description",
      "text": "Descriptions by ancient and medieval travellers agree that the lighthouse rose in three tapering stages: a square lower section with a central core, an octagonal middle section, and a circular upper section topped by a large statue, probably of Zeus Soter or Helios. Arab travellers who visited between the tenth and fourteenth centuries recorded measurements that, converted carefully, suggest a total height of just over 100 metres including the foundation platform.\n\nfigure: A three-stage stone tower rising from a fortified platform beside a harbour, drawn as an architectural reconstruction — A 2013 architectural reconstruction of the lighthouse based on the 1909 study by Hermann Thiersch.\n\nThe interior of the lowest stage reportedly contained a wide spiral ramp, allowing fuel for the beacon fire to be hauled up by pack animals. At the summit, a mirror — possibly of polished bronze — reflected sunlight during the day; a fire provided light by night. Some accounts claim the light could be seen up to 47 kilometres away. The ground stage also housed a garrison and stabling, and travellers describe hundreds of storage rooms opening off the ascending ramp.\n\n#### Later accounts\n\nThe traveller Ibn Battuta visited Alexandria in 1326 and again in 1349. On his first visit he found the lighthouse partly ruined but still possible to enter; on the second, he reported that the ruin was such that entry was no longer possible. His account is among the last eyewitness descriptions of the structure standing to any height."
    },
    {
      "id": "destruction",
      "summary": "The lighthouse was progressively destroyed by earthquakes in 956, 1303 and 1323 AD.",
      "tags": [],
      "anchor": "#destruction",